<?xml version="1.0" encoding="UTF-8"?>
<!--Sample XML file generated by XMLSpy v2007 sp2 (http://www.altova.com)-->
<Config xsi:noNamespaceSchemaLocation="WeblogicConfig.xsd" xmlns:xsi="http://www.w3.org/2001/XMLSchema-instance">
	<Environment Name="Dev - VTSTESTBJ">
		<DataSource>
			<Name>Deployment2</Name>
			<url>jdbc:bea:oracle://</url>
			<serverName>vhaislbll13</serverName>
			<sid>etsd03</sid>
			<userName>vtstestbj</userName>
			<password>vtstestbj</password>
		</DataSource>
		<DataSource>
			<Name>Services</Name>
			<url>jdbc:bea:oracle://</url>
			<serverName>vhaislbll13</serverName>
			<sid>etsd03</sid>
			<userName>vtstestbj</userName>
			<password>vtstestbj</password>
		</DataSource>
		<DataSource>
			<Name>Vuid</Name>
			<url>jdbc:bea:oracle://</url>
			<serverName>vhaislbll13</serverName>
			<sid>etsd03</sid>
			<userName>vtstestbj</userName>
			<password>vtstestbj</password>
		</DataSource>
	</Environment>
	<Environment Name="Local - VTSTESTBJ">
		<DataSource>
			<Name>Deployment2</Name>
			<url>jdbc:bea:oracle://</url>
			<serverName>localhost</serverName>
			<sid>STSBJ</sid>
			<userName>vtstestbj</userName>
			<password>vtstestbj</password>
		</DataSource>
		<DataSource>
			<Name>Services</Name>
			<url>jdbc:bea:oracle://</url>
			<serverName>localhost</serverName>
			<sid>STSBJ</sid>
			<userName>vtstestbj</userName>
			<password>vtstestbj</password>
		</DataSource>
		<DataSource>
			<Name>Vuid</Name>
			<url>jdbc:bea:oracle://</url>
			<serverName>localhost</serverName>
			<sid>STSBJ</sid>
			<userName>vtstestbj</userName>
			<password>vtstestbj</password>
		</DataSource>
	</Environment>
	<Environment Name="INT - VTS_V09">
		<DataSource>
			<Name>Deployment2</Name>
			<url>jdbc:bea:oracle://</url>
			<serverName>VHAISLBLL26.VHA.MED.VA.GOV</serverName>
			<sid>STSI01</sid>
			<userName>VTS_V09</userName>
			<password>vts_v09</password>
		</DataSource>
		<DataSource>
			<Name>Services</Name>
			<url>jdbc:bea:oracle://</url>
			<serverName>VHAISLBLL26.VHA.MED.VA.GOV</serverName>
			<sid>STSI01</sid>
			<userName>DS_V09</userName>
			<password>ds_v09</password>
		</DataSource>
		<DataSource>
			<Name>Vuid</Name>
			<url>jdbc:bea:oracle://</url>
			<serverName>VHAISLBLL26.VHA.MED.VA.GOV</serverName>
			<sid>STSI01</sid>
			<userName>VUID_V09</userName>
			<password>vuid_v09</password>
		</DataSource>
	</Environment>
</Config>
